286,Behind,Exactly concern once student heart.,18.97,https://dummyimage.com/479x14,Salad
287,Church,Either every able officer civil sometimes.,27.79,https://dummyimage.com/149x389,Dessert
288,Serve,Politics wrong important line medical campaign the.,17.33,https://picsum.photos/406/563,Burger
289,Pull,Lawyer course central short night evening chair.,47.34,https://picsum.photos/901/963,Dessert
290,Issue,Sing wall could.,14.6,https://picsum.photos/86/785,Pizza
291,Audience,Themselves stock serve movie many whole.,10,https://dummyimage.com/304x716,Pizza
292,Member,Collection they memory cell.,25.16,https://placekitten.com/853/390,Sushi
293,Under,Person bag end pretty blue agency.,30.23,https://dummyimage.com/299x954,Pasta
294,Carry,Challenge author drive social itself off box myself.,32.14,https://picsum.photos/16/349,Burger
295,Option,Politics claim beyond see then beautiful choice.,18.26,https://dummyimage.com/173x590,Salad
296,Before,Artist born under billion rock stay.,27.81,https://dummyimage.com/260x434,Pasta
297,Kitchen,Sing return garden south set eye ago.,24.61,https://picsum.photos/202/142,Pasta
298,Condition,Congress fight condition environmental.,38.59,https://picsum.photos/525/271,Salad
299,Open,Behavior modern hour important.,5.43,https://placekitten.com/154/132,Burger
300,Drug,Up watch community.,21.19,https://dummyimage.com/366x892,Burger
301,Authority,Deep away animal ever local speak state.,46.92,https://dummyimage.com/887x777,Pizza
302,Republican,Walk design wife indeed character debate.,47.3,https://dummyimage.com/418x868,Pizza
303,Pm,You step development stage choice success else.,36.11,https://placekitten.com/272/291,Pasta
304,Relationship,Development affect consumer apply fact.,44.25,https://picsum.photos/886/455,Pizza
305,Family,Appear too individual report.,18.63,https://picsum.photos/863/61,Burger
306,Concern,Soldier per yard bar operation join because.,7.92,https://dummyimage.com/123x288,Pizza
307,Here,Bank from president western.,14.69,https://placekitten.com/896/396,Pizza
308,Firm,Cultural himself future she toward wear mission soldier.,16.21,https://picsum.photos/260/854,Salad
309,Political,Old far month thing board.,7.99,https://picsum.photos/613/359,Burger
310,Possible,Finally society reach owner baby.,20.49,https://placekitten.com/1004/403,Dessert
311,Actually,Oil newspaper seven meet speak.,11.87,https://dummyimage.com/34x305,Burger
312,Already,Though offer theory do account bring change.,39.75,https://picsum.photos/201/747,Dessert
313,Sense,Item open company charge information operation local.,49.38,https://placekitten.com/480/745,Burger
314,Then,According eat star growth early meeting wear.,16.27,https://placekitten.com/371/562,Dessert
315,Suddenly,Despite watch democratic detail success huge.,18.89,https://placekitten.com/319/770,Pizza
316,Under,Fear still Republican.,15.92,https://placekitten.com/371/445,Dessert
317,View,Parent military fall new.,10.45,https://dummyimage.com/174x911,Salad
318,Responsibility,Heart off baby everybody old.,29.29,https://picsum.photos/690/900,Pasta
319,Me,Truth since better kid me understand.,9.52,https://placekitten.com/807/428,Pizza
320,Certain,Plan type effort might color special.,32.62,https://placekitten.com/256/277,Sushi
321,Change,Tv bank else leg ok wrong.,24.52,https://picsum.photos/41/674,Dessert
322,News,We training cup tonight.,38.8,https://dummyimage.com/767x754,Burger
323,Company,Others kind space else away remain dark evening.,33.48,https://dummyimage.com/657x766,Pasta
324,Improve,Field deep cover nation now by lot.,40.95,https://dummyimage.com/982x520,Salad
325,Stuff,Position matter pattern student budget.,29.28,https://picsum.photos/71/846,Salad
326,Consider,By check able least blood your throw.,8.38,https://placekitten.com/199/24,Burger
327,Bit,Inside watch past later hotel suggest brother.,40.68,https://dummyimage.com/887x960,Sushi
328,Remember,Specific generation argue other most like new.,5.67,https://dummyimage.com/141x1001,Sushi
329,Relationship,Catch several avoid provide strategy.,11.33,https://picsum.photos/595/92,Salad
330,Drive,Market out relationship movie class ground shoulder join.,28.74,https://dummyimage.com/1000x243,Dessert
331,Raise,Course list food economy country team process.,40.85,https://dummyimage.com/148x826,Salad
332,Four,Edge small without support though.,16.47,https://dummyimage.com/855x159,Burger
333,Represent,Other soldier more instead child top stuff.,35.01,https://placekitten.com/550/447,Burger
334,Political,Health such possible compare enough while condition.,29.87,https://dummyimage.com/303x548,Pasta
335,Seven,Toward focus whose religious thought.,47.84,https://picsum.photos/835/761,Pizza
336,Bar,Blue office out indicate this material either.,20.5,https://picsum.photos/516/630,Burger
337,Wish,Necessary nature per themselves base before.,12.62,https://dummyimage.com/882x204,Pasta
338,Line,Defense police under.,33.26,https://dummyimage.com/947x205,Pasta
339,Medical,Care against money with every speech through.,36.04,https://picsum.photos/427/215,Pasta
340,Much,Medical off film important.,7.62,https://dummyimage.com/652x614,Pizza
341,Health,Young real learn mention catch against within.,25.73,https://picsum.photos/433/412,Pasta
342,Different,Work growth know job case.,8.66,https://dummyimage.com/890x385,Sushi
343,Condition,Follow huge red environment financial blood different.,43.61,https://picsum.photos/569/433,Sushi
344,Democratic,Media evidence worry final green.,8.12,https://dummyimage.com/811x214,Salad
345,Science,Ago he necessary.,46.8,https://picsum.photos/821/795,Sushi
346,Task,Hear worry really positive however maintain once.,19.28,https://placekitten.com/588/569,Dessert
347,Room,Region report yes either.,48.13,https://picsum.photos/62/1016,Pasta
348,Wide,Newspaper night shake quickly.,13.83,https://dummyimage.com/438x118,Salad
349,Project,Under Mr myself new.,16.36,https://placekitten.com/525/141,Burger
350,Region,Fact little man foot often.,47.57,https://dummyimage.com/918x133,Sushi
351,Agent,Us baby approach where here.,47.07,https://picsum.photos/114/223,Dessert
352,Now,News study say wall purpose account type significant.,33.43,https://dummyimage.com/64x985,Sushi
353,Cause,Environment successful several sit western road.,44.14,https://picsum.photos/878/571,Dessert
354,Responsibility,Book happy day ago if.,45.91,https://dummyimage.com/35x322,Salad
355,Should,Challenge little manager.,18.53,https://picsum.photos/820/1000,Pizza
356,Lawyer,Full study law effect.,27.18,https://picsum.photos/373/327,Dessert
357,Home,Ask fund during lose identify deep.,40.44,https://placekitten.com/814/203,Pasta
358,Service,Heavy finally growth finish.,23.87,https://dummyimage.com/634x731,Dessert
359,Know,Pass product nation room main friend politics.,15.58,https://picsum.photos/493/207,Pizza
360,Standard,Never ok dark.,48.86,https://picsum.photos/911/755,Sushi
361,Decision,Edge anyone though.,13.41,https://placekitten.com/240/589,Salad
362,Subject,Game about meeting.,31.87,https://picsum.photos/27/896,Pizza
363,Message,Occur tonight carry east shake writer.,43.26,https://dummyimage.com/484x656,Pizza
364,Age,Adult hit thus state really senior others west.,22.27,https://placekitten.com/655/929,Pasta
365,Report,Price who hard list evidence theory after.,47.43,https://picsum.photos/527/635,Burger
366,Machine,Customer note measure.,26.02,https://dummyimage.com/678x919,Burger
367,Yard,So represent himself anyone event wait character long.,17.7,https://picsum.photos/225/794,Dessert
368,Teach,Fact magazine into central.,37,https://picsum.photos/231/748,Dessert
369,Professional,Include company rate moment.,47.17,https://dummyimage.com/443x776,Pasta
370,Usually,Goal sign age score source fact recently painting.,8.65,https://picsum.photos/816/465,Sushi
371,Society,Tv item gun create religious choice.,21.04,https://dummyimage.com/86x300,Dessert
372,Last,West add wife PM interesting avoid soon.,39.89,https://picsum.photos/451/21,Burger
373,Operation,Participant data ok market prove.,18.33,https://placekitten.com/428/466,Pizza
374,Draw,Begin benefit low policy everything interest.,42.99,https://dummyimage.com/244x307,Burger
375,Serious,Hour decade forward economy difficult.,33.56,https://placekitten.com/752/1016,Pasta
376,Happen,Near color call myself bring player know.,10.02,https://placekitten.com/40/327,Sushi
377,While,Always or even central until prevent local single.,29.02,https://picsum.photos/839/904,Burger
378,Several,Phone yeah hotel she ground.,5.72,https://picsum.photos/275/984,Dessert
379,Modern,Sister image baby.,30.74,https://picsum.photos/528/672,Dessert
380,Meet,Deal level where.,9.8,https://picsum.photos/163/949,Dessert
381,Situation,Environmental until reality key laugh.,27.05,https://placekitten.com/539/246,Pasta
382,Good,Process affect chance child past back standard.,46.31,https://placekitten.com/1002/516,Salad
383,Toward,Today whether easy recently guess allow.,19.74,https://picsum.photos/360/251,Pasta
384,Something,Under plant someone question across east sing prepare.,30.61,https://dummyimage.com/827x254,Dessert
385,City,Challenge first idea area agree break.,41.16,https://dummyimage.com/952x74,Sushi
386,It,Shoulder control some name fear another.,15.28,https://placekitten.com/45/900,Dessert
387,Instead,Thousand indicate business capital democratic security hear.,10.98,https://dummyimage.com/316x969,Pasta
388,Economic,New open success history talk fall.,21.83,https://dummyimage.com/285x915,Burger
389,By,Section either everyone.,13.64,https://placekitten.com/390/210,Salad
390,Occur,Ago agree shake rate either that free song.,36.17,https://dummyimage.com/667x78,Sushi
391,Another,Name choice civil nothing.,23.11,https://placekitten.com/695/402,Pizza
392,Fight,Speak old though soon.,5.62,https://picsum.photos/552/309,Salad
393,Cold,If range source of local.,27.27,https://picsum.photos/504/938,Sushi
394,Hit,Mouth sport few road.,46.9,https://picsum.photos/302/867,Pizza
395,Health,Apply body or whom.,29.56,https://dummyimage.com/260x453,Pasta
396,Environment,Seven only approach worry newspaper weight source knowledge.,36.91,https://placekitten.com/682/269,Pizza
397,Coach,Address role fine indeed attorney employee.,29.58,https://picsum.photos/871/257,Salad
398,Rise,Never page card range environmental experience anything.,25.11,https://dummyimage.com/715x296,Pizza
399,Down,Development pay start.,27.26,https://picsum.photos/628/133,Salad
400,High,Together process senior relate cold order together.,29.73,https://placekitten.com/289/867,Salad
401,Base,Official employee think hundred tonight various.,34.6,https://picsum.photos/219/303,Dessert
402,Week,American night deal tell week hear staff.,45.35,https://dummyimage.com/726x324,Sushi
403,Yourself,Agreement occur minute six interest site I yard.,33.94,https://picsum.photos/299/821,Salad
404,Understand,Myself they thus.,8.84,https://dummyimage.com/774x964,Pasta
405,Morning,Would store career off catch.,42.93,https://placekitten.com/100/124,Salad
406,Suggest,Direction language close food whole article.,21.1,https://dummyimage.com/895x72,Burger
407,Lead,Help begin eat.,5.2,https://dummyimage.com/683x163,Salad
408,Take,Yeah affect particularly agree Democrat deal.,39.01,https://dummyimage.com/515x302,Pasta
409,Sure,List understand raise better professional behavior only.,12.53,https://placekitten.com/645/755,Sushi
410,Mission,Let none end so coach understand director.,47.42,https://picsum.photos/394/421,Pizza
411,Consider,Trade service total season into now.,17.53,https://placekitten.com/271/225,Salad
412,Exactly,Indeed different machine deep.,5.27,https://dummyimage.com/631x497,Sushi
413,Oil,Report look during out.,24.75,https://placekitten.com/435/505,Pasta
414,Particularly,Huge home structure discussion ability position.,24.18,https://placekitten.com/378/611,Pizza
415,Down,Visit grow worry something.,20.69,https://dummyimage.com/676x940,Dessert
416,Respond,Use employee student save.,36.9,https://dummyimage.com/267x311,Pasta
417,Reveal,Particular onto station safe research why.,18.07,https://dummyimage.com/857x942,Burger
418,Television,Role military write fear fire together responsibility material.,32.08,https://placekitten.com/274/957,Burger
419,Measure,Morning something pick.,14.38,https://dummyimage.com/400x38,Burger
420,Leave,Discover her center real probably product region site.,22.11,https://dummyimage.com/348x360,Pizza
421,Seek,Every structure point democratic though.,31.54,https://picsum.photos/662/552,Dessert
422,Ever,Red focus deal time situation make yet.,15.3,https://picsum.photos/470/372,Salad
423,Inside,Value use write we ok knowledge evidence from.,15.26,https://dummyimage.com/556x393,Burger
424,Agency,High son method customer.,48.28,https://placekitten.com/179/115,Sushi
425,Health,Able least its third.,32.26,https://placekitten.com/519/90,Pizza
426,Believe,Money dog mission building easy.,45.92,https://dummyimage.com/191x377,Pasta
427,Between,Simply computer worry support short growth.,21.68,https://placekitten.com/928/327,Salad
428,Prevent,Current politics huge page.,49.24,https://placekitten.com/904/972,Pizza
429,Show,Series often many history move follow thank.,28.57,https://picsum.photos/37/813,Pizza
430,Sport,Build make girl attention cut civil together.,19.88,https://placekitten.com/1018/922,Pasta
431,Campaign,Give lead true picture letter.,47.19,https://dummyimage.com/356x719,Pasta
432,Your,Item of improve east.,27.38,https://picsum.photos/859/557,Pasta
433,They,Per baby more discuss business.,43.79,https://picsum.photos/541/771,Dessert
434,Part,Try traditional mission attorney professional college commercial.,16.61,https://placekitten.com/596/1024,Pasta
435,Mrs,Set worker need because would.,29.96,https://picsum.photos/367/744,Pizza
436,Remember,Teach or space ever.,30.74,https://picsum.photos/671/886,Dessert
437,Every,Your political mother coach various less.,20.72,https://placekitten.com/314/116,Burger
438,Hotel,Those bill go professor.,24.88,https://picsum.photos/666/774,Pasta
439,Available,Lot whole tree through land consider.,37.51,https://placekitten.com/246/856,Pasta
440,Focus,Situation human surface report want customer heavy.,44.39,https://dummyimage.com/499x397,Pasta
441,Add,Quickly poor well five.,36.11,https://picsum.photos/11/346,Burger
442,Sell,Cover phone lead job police degree.,23.59,https://placekitten.com/401/899,Dessert
443,Suffer,Page budget particularly.,18.03,https://placekitten.com/701/912,Pasta
444,Small,Authority civil environment cut where.,12.54,https://picsum.photos/710/829,Salad
445,Include,Front long experience thank none painting evening.,38.77,https://dummyimage.com/816x82,Salad
446,Easy,Itself attention animal represent administration.,36.14,https://picsum.photos/220/638,Pasta
447,Skill,Less task party forget describe treat.,38.82,https://picsum.photos/709/440,Burger
448,Industry,Almost skin wonder scientist life professional.,49.55,https://picsum.photos/846/376,Dessert
449,Main,International total would ability.,8.19,https://placekitten.com/71/517,Sushi
450,Few,According and throw pick really hear top here.,46.82,https://picsum.photos/988/598,Pasta
451,Teacher,Final those themselves mind put benefit according international.,46.79,https://placekitten.com/128/306,Pizza
452,Mission,Blue board exist reach order natural house personal.,8.74,https://dummyimage.com/525x555,Dessert
453,Too,Until today run others century large.,18.25,https://picsum.photos/257/219,Dessert
454,Stop,Five international as that authority.,32.18,https://dummyimage.com/132x344,Burger
455,Card,End police serve bed mind quite.,12.64,https://placekitten.com/567/966,Sushi
456,Professor,Man charge shoulder finally concern.,48.41,https://picsum.photos/507/269,Sushi
457,So,Mr analysis western color film if.,41.46,https://picsum.photos/222/949,Salad
458,Me,Do student summer traditional sound seven.,11.15,https://placekitten.com/37/1004,Burger
459,However,Next themselves special happy everybody.,47.01,https://placekitten.com/400/792,Pasta
460,Fight,High professor consider subject movement north.,17.1,https://placekitten.com/757/327,Pizza
461,Culture,Road whatever system.,24.66,https://picsum.photos/877/172,Sushi
462,Carry,Few central the teacher.,47.6,https://picsum.photos/270/972,Pasta
463,Technology,Recent movie enter reason threat.,13.57,https://placekitten.com/918/631,Dessert
464,Star,Quality seek stage girl role.,42.75,https://picsum.photos/466/969,Sushi
465,Matter,North allow head bill official many consumer.,8.33,https://picsum.photos/174/609,Dessert
466,Arrive,Party agent positive owner because.,39.56,https://picsum.photos/306/325,Pizza
467,Walk,Condition fine join answer.,22.6,https://dummyimage.com/143x286,Pasta
468,Whom,We new heavy store bill prepare cost.,36.11,https://picsum.photos/580/509,Dessert
469,Truth,Fall others sing account administration offer continue food.,14.5,https://dummyimage.com/575x1023,Burger
470,Into,Bit everyone address could issue foreign.,17.73,https://picsum.photos/924/33,Salad
471,Not,War then parent receive decide a attack.,48.57,https://placekitten.com/469/830,Pizza
472,Person,Argue break sound oil.,46.86,https://placekitten.com/457/63,Pasta
473,Already,Before choose PM sing heart.,12.23,https://placekitten.com/569/474,Pasta
474,Discuss,Level protect talk position result case give.,15.96,https://picsum.photos/985/151,Salad
475,Key,Reality hear middle this blood.,22.57,https://placekitten.com/48/363,Dessert
476,Far,Move Republican general fact crime.,38.94,https://placekitten.com/988/907,Dessert
477,Story,Meet between behind four organization smile sometimes.,38.62,https://dummyimage.com/293x435,Pizza
478,Professional,Prevent building moment name cup do.,9.61,https://dummyimage.com/373x294,Dessert
479,Recent,Rule doctor industry learn health force.,27.34,https://dummyimage.com/115x268,Sushi
480,Pm,Discussion young business same fast entire defense.,22.69,https://picsum.photos/1000/232,Salad
481,Foot,Identify mind inside computer create fine.,13.94,https://picsum.photos/727/599,Dessert
482,Act,Although tree state sure.,11.34,https://placekitten.com/102/117,Pasta
483,Possible,Method beyond arm room only capital.,42.71,https://picsum.photos/713/1,Sushi
484,Place,Almost who capital than various around.,11.22,https://picsum.photos/654/706,Sushi
485,Current,Suffer particularly position.,27.58,https://dummyimage.com/984x556,Burger
486,Thus,Than particularly but piece.,30.56,https://placekitten.com/187/82,Pizza
487,Center,Various watch stock clear already.,37.25,https://placekitten.com/910/723,Sushi
488,Occur,Rate west both church.,34.11,https://picsum.photos/486/940,Salad
489,Born,Most authority people too worry decade he measure.,14.03,https://dummyimage.com/661x103,Burger
490,Pm,Throw central science bank.,40.94,https://dummyimage.com/203x830,Burger
491,Interesting,Provide everyone east trade attack.,35.16,https://dummyimage.com/779x550,Sushi
492,Position,Whole it when human thus never.,22.93,https://dummyimage.com/855x136,Sushi
493,Air,Other than glass particularly.,16.72,https://placekitten.com/1005/132,Pasta
494,Rock,Realize citizen case example.,42.44,https://dummyimage.com/976x956,Sushi
495,Quite,Option true time must tonight save.,26.13,https://picsum.photos/980/422,Sushi
496,Tv,Strong project growth official race provide.,44.64,https://placekitten.com/250/753,Pizza
497,Might,Go set discover enjoy spend beat.,41.32,https://picsum.photos/540/339,Salad
498,Issue,Major gas watch save back.,36.88,https://placekitten.com/239/467,Burger
499,Staff,Also truth no pick.,45.19,https://picsum.photos/148/601,Sushi
500,Board,Year challenge service evening.,47.96,https://dummyimage.com/1016x528,Pasta
501,Car,Left culture light career few then not job.,45.88,https://picsum.photos/153/955,Pizza
502,Young,East building decide current son site billion.,37.19,https://dummyimage.com/386x390,Dessert
503,Talk,Include compare rise heavy we each seem good.,10.62,https://picsum.photos/37/178,Sushi
504,Next,Challenge certainly join lot.,27.22,https://placekitten.com/579/745,Pasta
505,Visit,Why me trade science.,28.46,https://placekitten.com/832/188,Salad
506,Town,Suffer happen very important individual.,27.1,https://picsum.photos/329/32,Sushi
507,Science,Hard professional sure I avoid young American maintain.,23.7,https://picsum.photos/148/83,Pizza
508,Off,Result what oil.,9.66,https://dummyimage.com/47x872,Pasta
509,Fish,Science skill share keep.,25.41,https://picsum.photos/629/120,Pasta
510,Customer,Their instead his just PM several.,34.08,https://placekitten.com/595/250,Pizza
511,Water,Large red box yes budget.,11.5,https://picsum.photos/9/729,Sushi
512,Suffer,Election two risk region husband.,6.78,https://dummyimage.com/677x505,Salad
513,Produce,Place property business car stuff majority.,8.64,https://placekitten.com/617/415,Burger
514,Answer,Daughter one form within.,44.69,https://placekitten.com/660/663,Salad
515,Since,Which military save partner time place.,25.11,https://dummyimage.com/883x654,Sushi
516,Song,Risk guess heart election gun shake talk.,13.98,https://placekitten.com/174/915,Sushi
517,International,Stop sit player bad prove.,20.65,https://picsum.photos/921/213,Burger
518,Relate,Owner commercial direction talk.,39.58,https://dummyimage.com/849x276,Pasta
519,Inside,General mother popular explain.,23.48,https://placekitten.com/313/835,Burger
520,Likely,Age party politics role red.,11.83,https://picsum.photos/330/405,Pizza
521,Different,Then body together capital seem action.,34.27,https://placekitten.com/664/89,Sushi
522,Behavior,Difference college first pull.,39.41,https://placekitten.com/253/912,Burger
523,View,Star bit market.,10.03,https://dummyimage.com/26x98,Dessert
524,Hair,Shake while mouth voice fly figure mission.,13.55,https://placekitten.com/286/135,Sushi
525,Sea,Because owner significant make heavy party.,36.34,https://dummyimage.com/839x346,Pizza
526,Role,Crime six common.,10.7,https://dummyimage.com/716x256,Sushi
527,Or,Sea no environment lay I these authority fear.,20.7,https://picsum.photos/772/34,Pizza
528,Nice,During democratic option better such tough.,43.22,https://placekitten.com/11/726,Pizza
529,Care,Customer bill place man.,44.85,https://picsum.photos/582/735,Pizza
530,This,Politics realize play sit school.,15.77,https://placekitten.com/901/703,Pizza
531,Road,Design which always drive there institution.,24.12,https://dummyimage.com/723x446,Pasta
532,Before,Race owner then where.,33.52,https://placekitten.com/91/268,Pasta
533,Compare,More will single standard.,31.73,https://picsum.photos/812/195,Salad
534,Capital,Open small much picture run.,11.67,https://placekitten.com/627/500,Sushi
535,End,Apply evening eye institution leave then.,10.63,https://dummyimage.com/962x244,Sushi
536,Father,Big capital likely power turn pressure training response.,16.65,https://picsum.photos/677/874,Pizza
537,Letter,Charge movie dream technology your.,21.1,https://dummyimage.com/675x633,Pizza
538,Employee,Public support network scientist senior.,21.64,https://dummyimage.com/275x18,Pizza
539,Economy,Song water ability national customer sure.,12.06,https://picsum.photos/693/357,Burger
540,TRUE,Spend according baby study require participant kind.,34.07,https://picsum.photos/823/756,Burger
541,Behavior,Entire give ever first establish.,37.07,https://dummyimage.com/756x751,Salad
542,Type,Between car role market upon much.,40.09,https://placekitten.com/60/226,Pasta
543,Red,About ago scene building growth.,25.67,https://dummyimage.com/968x700,Salad
544,Quite,Recent player sing per.,25.61,https://dummyimage.com/170x160,Pizza
545,Develop,People behind explain tell themselves huge nor buy.,16.89,https://placekitten.com/992/777,Burger
546,Face,Measure pass small may.,37.3,https://picsum.photos/150/478,Dessert
547,Box,Subject case wide national best old because.,46.13,https://dummyimage.com/997x379,Pizza
548,Scientist,Already now sense science pressure.,47.04,https://placekitten.com/473/420,Pasta
549,Western,Dog fish practice law woman ever.,29.21,https://dummyimage.com/103x47,Salad
550,His,Feel outside heavy.,35.3,https://placekitten.com/395/899,Salad
551,Total,Probably floor child doctor.,45.44,https://placekitten.com/1008/925,Sushi
552,Money,Walk out guy bed.,15.49,https://dummyimage.com/844x395,Salad
553,Cultural,Election him full state man election.,9.44,https://placekitten.com/98/297,Sushi
554,Suffer,Finish ok all difference but sound appear care.,11.83,https://placekitten.com/520/884,Sushi
555,Learn,Growth fire long four energy use.,27.94,https://picsum.photos/232/550,Dessert
556,Standard,Size figure land subject.,21.31,https://placekitten.com/251/49,Salad
557,Art,Whether learn game so on brother.,7.42,https://placekitten.com/949/111,Dessert
558,Game,Camera window do station century wide about realize.,18.29,https://placekitten.com/517/215,Pasta
559,Serious,Season pass security simply score anyone.,37.58,https://placekitten.com/869/914,Dessert
560,Bill,Must market hand bill full item.,23.05,https://dummyimage.com/674x926,Sushi
561,Source,Road stay short citizen movement determine.,30.9,https://picsum.photos/821/132,Dessert
562,Majority,Indicate foreign unit thing.,28.1,https://picsum.photos/411/390,Salad
563,Put,Along often work feeling measure all base.,9.97,https://picsum.photos/485/250,Burger
564,Glass,Perform picture floor yet.,42.06,https://picsum.photos/360/220,Salad
565,Coach,Ever describe head until bring why shake set.,33.33,https://picsum.photos/979/740,Pasta
566,Language,Court daughter season statement expect week movement.,36.69,https://placekitten.com/209/149,Pasta
567,Decision,City kind bill anything send pass partner.,10.47,https://dummyimage.com/881x586,Sushi
568,Prevent,Forward current little few part father left.,45.78,https://placekitten.com/454/81,Pizza
569,Tonight,Population imagine win dark two build.,26.39,https://placekitten.com/595/267,Pasta
570,Industry,Wish identify factor.,38.95,https://placekitten.com/1015/322,Pizza
