1,Alone,International region born.,6.19,https://placekitten.com/666/597,Burger
2,Maintain,Family manager product over.,5.53,https://dummyimage.com/875x974,Burger
3,Of,Office mission arm spend.,48.84,https://picsum.photos/976/48,Dessert
4,Such,Raise shake your operation size finally.,34.77,https://dummyimage.com/506x866,Sushi
5,Range,Head stand six garden land member.,29.88,https://picsum.photos/244/232,Salad
6,Culture,Clear character good indeed during.,9.45,https://placekitten.com/239/963,Salad
7,Month,Thank everyone near foot big well.,37.14,https://placekitten.com/188/15,Salad
8,Learn,Participant first exist happen business her former.,41.51,https://placekitten.com/792/906,Pizza
9,Indicate,Career century one impact could military establish imagine.,44.21,https://picsum.photos/757/746,Salad
10,Can,Military grow imagine body program himself himself former.,37.43,https://dummyimage.com/100x696,Salad
11,Think,Play good fear its from.,19.18,https://placekitten.com/158/1014,Dessert
12,Service,Red son past social.,17.46,https://placekitten.com/610/70,Salad
13,Beautiful,Family discussion property alone.,47.93,https://picsum.photos/159/202,Dessert
14,Cold,Several already site debate source.,9.18,https://placekitten.com/326/775,Salad
15,Open,Enough adult career huge parent figure accept.,11.3,https://placekitten.com/282/856,Sushi
16,Artist,Try require church money among.,16.12,https://placekitten.com/595/223,Burger
17,Probably,Defense design then less.,16.15,https://dummyimage.com/966x609,Burger
18,Represent,Score theory toward official perhaps.,29.47,https://picsum.photos/418/689,Pasta
19,Meet,Discussion human three bit central movie.,22.74,https://placekitten.com/1016/179,Salad
20,World,Newspaper much least record explain foreign skill need.,39.62,https://dummyimage.com/57x589,Pasta
21,Provide,Vote blue scientist south sometimes bill like.,25.22,https://dummyimage.com/773x274,Pasta
22,Sort,Full create money wait long industry.,31.3,https://placekitten.com/337/461,Burger
23,Reality,Actually office move letter ago kid.,28.78,https://placekitten.com/408/608,Sushi
24,The,Party citizen relationship drug often also.,9.6,https://picsum.photos/840/467,Salad
25,Billion,Administration participant door pay window eat.,37.24,https://placekitten.com/913/738,Pizza
26,Itself,Degree decision during think college skill.,17.44,https://placekitten.com/461/102,Burger
27,Walk,Us large her happen might.,13.44,https://picsum.photos/280/51,Dessert
28,See,Ground window rest film down nor man.,15.19,https://picsum.photos/820/823,Salad
29,Fall,Mission manager involve music source.,5.13,https://dummyimage.com/880x510,Sushi
30,Will,Guess nearly yeah live.,22.89,https://placekitten.com/850/650,Sushi
31,Participant,Hundred site significant human receive recognize message.,42.12,https://dummyimage.com/69x683,Salad
32,Long,Small go others argue coach president.,39.89,https://placekitten.com/86/271,Salad
33,Hear,Strong election attorney tend name free not.,47.27,https://placekitten.com/867/971,Pizza
34,Sell,Level occur paper serve room own.,11.08,https://picsum.photos/57/139,Salad
35,Modern,Reflect between set visit hotel another police receive.,6.78,https://picsum.photos/162/478,Pizza
36,Mouth,Decide western agreement enter politics.,42.99,https://dummyimage.com/937x227,Dessert
37,Business,Edge join among medical measure.,43.02,https://placekitten.com/78/434,Sushi
38,Hope,Form west single weight.,19.11,https://picsum.photos/536/688,Pizza
39,Space,When worker arm bring cover smile suddenly.,35.7,https://picsum.photos/124/671,Sushi
40,Provide,Parent economy threat including mean perhaps enjoy leave.,40.25,https://picsum.photos/180/804,Burger
41,Where,Window a day read.,11.33,https://dummyimage.com/544x988,Dessert
42,Teacher,Save high trouble.,36.71,https://dummyimage.com/980x827,Salad
43,Key,Strategy clear space education she perform drug.,15.24,https://dummyimage.com/277x150,Burger
44,Politics,Close attention sea better she letter.,5.96,https://dummyimage.com/819x974,Burger
45,Truth,Second do lot tax conference expert management.,27.99,https://placekitten.com/896/232,Sushi
46,Since,Discuss down short.,17.35,https://placekitten.com/985/38,Burger
47,For,Seven short enjoy possible Mr.,23.43,https://placekitten.com/152/41,Sushi
48,Without,Become do run already food unit.,21.97,https://picsum.photos/407/1017,Sushi
49,Speech,Box range sea actually hear.,22.67,https://dummyimage.com/609x712,Pizza
50,Gas,Hear method lawyer military call.,35.06,https://dummyimage.com/299x27,Pizza
51,Edge,Society individual direction since education because trade religious.,32.82,https://picsum.photos/247/877,Pasta
52,Break,Pretty walk cut standard history social official cover.,21.15,https://picsum.photos/709/807,Burger
53,Source,Court movie sit forget your.,48.08,https://placekitten.com/15/715,Burger
54,Relationship,Participant yet start large camera.,32.9,https://placekitten.com/55/1024,Sushi
55,Southern,Near piece eight whatever vote up environmental goal.,7.12,https://dummyimage.com/810x605,Dessert
56,Decide,Night community choose.,21.67,https://dummyimage.com/562x42,Pasta
57,Cold,Area staff need plan but test free local.,13.17,https://dummyimage.com/494x691,Burger
58,Risk,Community development probably.,29.35,https://picsum.photos/8/120,Pasta
59,Consider,Story leg respond safe hard could.,23.82,https://placekitten.com/334/830,Dessert
60,Weight,Change power many represent work hair official.,43.22,https://dummyimage.com/29x123,Pasta
61,Miss,Interest discover skill.,32.04,https://dummyimage.com/438x290,Salad
62,Tree,Check hard happen third next bit over.,31.64,https://placekitten.com/905/130,Pizza
63,Government,On majority one expect she hard west.,20.22,https://placekitten.com/848/959,Sushi
64,Too,Cause charge song job.,17.21,https://dummyimage.com/982x601,Burger
65,Cut,Employee red term week.,20.37,https://dummyimage.com/817x251,Burger
66,Card,Audience no difference perhaps major red.,33.63,https://picsum.photos/546/799,Salad
67,Interest,Capital mention play.,16.69,https://dummyimage.com/92x503,Burger
68,Direction,Name soldier color.,38.74,https://picsum.photos/595/347,Salad
69,Easy,Medical service generation staff third second.,41.43,https://dummyimage.com/384x590,Burger
70,Get,North inside collection free resource building.,14.97,https://picsum.photos/74/516,Burger
71,Indeed,Stand member wide.,46.39,https://placekitten.com/485/771,Pizza
72,Particular,Mind exist support.,24.55,https://picsum.photos/658/355,Salad
73,Attorney,Including decision strong budget write foreign.,9.52,https://dummyimage.com/510x817,Pasta
74,Process,Technology recently guess majority information page board share.,40.15,https://picsum.photos/30/283,Pasta
75,Kid,Opportunity dinner letter population describe size compare.,46.88,https://picsum.photos/504/50,Salad
76,How,Next professor southern if all discover office.,25.65,https://picsum.photos/253/412,Burger
77,Interesting,Girl paper goal many.,15.97,https://picsum.photos/418/803,Pizza
78,Effort,Picture first teach character another.,13.58,https://picsum.photos/175/86,Pasta
79,Very,Table mouth certain local.,17.25,https://placekitten.com/767/281,Burger
80,Recognize,Check son authority oil firm.,39.02,https://placekitten.com/425/467,Sushi
81,Even,Able production book thus whom mother with.,36.38,https://dummyimage.com/970x610,Pizza
82,What,Ball trial head almost form service rather name.,42.02,https://picsum.photos/699/22,Burger
83,Former,Office director she music forget.,21.58,https://dummyimage.com/850x798,Pizza
84,Stock,Leg way attention meet cover with sort.,29.42,https://placekitten.com/997/218,Pizza
85,Attorney,Life concern meet bank economy.,30.13,https://dummyimage.com/961x790,Pasta
86,Picture,Control better age.,12.01,https://picsum.photos/53/576,Burger
87,Race,Run situation policy candidate.,21.6,https://picsum.photos/234/667,Sushi
88,Return,Worker bank year rate our debate involve.,38.96,https://picsum.photos/559/343,Sushi
89,Resource,Of blue pick.,15.89,https://dummyimage.com/102x60,Pasta
90,Paper,Let forget reach worry leg often happen.,32.46,https://picsum.photos/500/727,Dessert
91,Unit,Phone white weight minute beat specific somebody.,23.44,https://picsum.photos/898/971,Burger
92,Page,Fall edge factor born push.,12.41,https://placekitten.com/864/512,Salad
93,Purpose,Stuff street door human theory like.,12.97,https://placekitten.com/299/674,Sushi
94,Girl,Front cold customer meeting.,30.17,https://dummyimage.com/379x66,Sushi
95,Oil,Newspaper mention hope.,45.49,https://placekitten.com/977/607,Pasta
96,Our,Of for recognize town among position property.,46.76,https://placekitten.com/213/36,Salad
97,Special,Agreement subject able owner size car cell final.,46.04,https://dummyimage.com/792x258,Pasta
98,Board,Most I myself concern return friend itself.,7.83,https://dummyimage.com/620x9,Pizza
99,Life,Available during people oil.,7.29,https://picsum.photos/438/702,Pizza
100,Everything,Industry seat system leave weight arm offer.,40.91,https://placekitten.com/119/688,Pasta
101,Affect,Board suggest any course three system.,23.44,https://dummyimage.com/736x512,Sushi
102,Per,Politics likely sell red instead treatment know.,43.08,https://placekitten.com/597/972,Burger
103,List,Information project anyone enter relationship travel recognize business.,11.31,https://picsum.photos/852/426,Burger
104,What,Discover total mention so only so study.,14.19,https://placekitten.com/671/60,Pizza
105,Pay,Teach become quite through.,40.84,https://placekitten.com/692/230,Burger
106,Involve,Democratic same life career remember history center.,47.81,https://placekitten.com/322/252,Salad
107,Allow,Guess floor well art continue.,18.36,https://dummyimage.com/485x103,Salad
108,Reduce,Industry catch mouth debate development imagine tough surface.,46.64,https://placekitten.com/644/340,Dessert
109,Travel,Play wonder me bag bad year.,5.65,https://placekitten.com/772/1003,Dessert
110,Cut,Report region feel green unit carry song.,29.57,https://picsum.photos/851/793,Pizza
111,Amount,Hard radio recognize will yard fund.,35.02,https://dummyimage.com/137x815,Sushi
112,Different,Involve school most throw system.,49.27,https://dummyimage.com/367x336,Pasta
113,Now,Consumer world me miss eight eye.,9.3,https://picsum.photos/452/391,Pasta
114,Class,Under price rule there production country.,49.47,https://placekitten.com/389/50,Sushi
115,Early,Between culture book.,13.07,https://placekitten.com/624/947,Pizza
116,Ten,Media anything serve produce scene often development.,26.55,https://placekitten.com/561/975,Pasta
117,Year,Nation bring girl.,43.87,https://placekitten.com/675/76,Sushi
118,Arrive,Shake official front nature law forward.,47.78,https://dummyimage.com/656x441,Dessert
119,Away,Season at born natural interview side friend.,33.61,https://picsum.photos/312/178,Burger
120,Rich,Public success night former lawyer.,42.15,https://dummyimage.com/678x263,Dessert
121,Break,Well close great management toward.,13.49,https://placekitten.com/641/429,Sushi
122,Everybody,Maintain figure travel could.,15,https://picsum.photos/952/410,Pizza
123,Whether,Agency former whom although.,11.34,https://placekitten.com/136/565,Dessert
124,Stop,Drop century continue cold hospital eight.,11.61,https://picsum.photos/1012/451,Pasta
125,Design,Choose remain occur full spend former.,24.8,https://dummyimage.com/931x241,Pizza
126,Available,Vote compare establish often budget claim.,32.79,https://dummyimage.com/218x329,Pizza
127,On,Require everything daughter picture certain subject.,10.6,https://picsum.photos/478/155,Dessert
128,Beautiful,Cause true significant it of increase fire.,9.57,https://picsum.photos/553/132,Sushi
129,Interesting,Glass paper shoulder.,23.78,https://dummyimage.com/742x259,Pizza
130,Visit,Cell main music image.,37.96,https://dummyimage.com/110x931,Dessert
131,City,Energy what direction wonder inside.,26.49,https://dummyimage.com/407x562,Pizza
132,Seven,It that camera professional use.,35.07,https://picsum.photos/726/205,Pasta
133,Safe,Price eat interview listen around for.,42.76,https://dummyimage.com/185x233,Burger
134,Figure,Group whole new listen system.,27.34,https://dummyimage.com/845x140,Sushi
135,Possible,Arm director teacher but.,27.14,https://placekitten.com/222/831,Pasta
136,Serve,Gas right stand determine check middle management remember.,31.08,https://picsum.photos/158/100,Pasta
137,Little,Her strategy will budget.,31.51,https://picsum.photos/613/371,Salad
138,Head,Candidate investment southern party first believe play piece.,25.23,https://dummyimage.com/236x917,Salad
139,Happy,Street wonder third investment build picture describe.,41.91,https://placekitten.com/906/449,Pizza
140,Government,Defense everyone reflect Mr bit.,34.28,https://placekitten.com/495/1001,Pizza
141,Amount,Fight people even tax usually sure image alone.,47.97,https://dummyimage.com/805x794,Burger
142,Strategy,Admit yet student theory.,15.65,https://placekitten.com/94/328,Sushi
143,Base,Trouble friend color decade part.,8.63,https://dummyimage.com/299x528,Burger
144,Floor,Product area reduce future building wish part.,19.61,https://picsum.photos/137/434,Sushi
145,Bag,And hit together team phone develop life.,26.91,https://placekitten.com/165/103,Sushi
146,Friend,The member only option someone friend.,26.89,https://placekitten.com/553/364,Pasta
147,Base,Wife friend however address inside whether.,18.7,https://picsum.photos/720/37,Dessert
148,Party,Push pretty nor popular.,15.85,https://dummyimage.com/587x397,Pasta
149,Trip,Network after up offer authority role away others.,48.09,https://dummyimage.com/442x295,Pizza
150,Front,Leave control perhaps black me two.,33.25,https://dummyimage.com/301x398,Dessert
151,Rate,Region age central market.,27.54,https://placekitten.com/659/377,Pizza
152,Road,Medical anything work fight industry require.,13.46,https://dummyimage.com/319x165,Dessert
153,Baby,Treatment right leader wall.,37.08,https://picsum.photos/663/369,Dessert
154,Mean,Walk finish almost hard hundred.,13.81,https://dummyimage.com/439x372,Pizza
155,Weight,Exactly full institution drive trade but statement and.,26.86,https://picsum.photos/213/178,Dessert
156,Off,Friend onto because garden.,40.82,https://dummyimage.com/54x376,Pasta
157,Nearly,Design black third no.,40.06,https://picsum.photos/191/529,Burger
158,Buy,Traditional affect instead report almost.,22.14,https://dummyimage.com/448x51,Burger
159,Four,Let far nation development skill executive.,40.07,https://placekitten.com/411/764,Burger
160,National,Energy record seem public.,23.65,https://dummyimage.com/263x858,Pasta
161,Poor,Language including good attack.,48,https://picsum.photos/188/433,Pizza
162,Whose,Push blue practice staff act treatment collection hear.,8.78,https://dummyimage.com/383x314,Sushi
163,Store,Whom drop father same maybe.,22.05,https://dummyimage.com/146x1003,Pizza
164,Resource,Weight morning key dog.,40.11,https://picsum.photos/704/399,Sushi
165,Their,Feel treat sound produce describe religious walk.,44.19,https://placekitten.com/231/46,Sushi
166,Focus,Step news several arm.,36.01,https://picsum.photos/284/149,Burger
167,Adult,Green you article call why send.,28.67,https://dummyimage.com/244x310,Dessert
168,Certain,Music consider all enter attorney area.,19.63,https://picsum.photos/13/764,Dessert
169,Area,Student else bank consumer recently as.,22.42,https://picsum.photos/640/526,Pizza
170,Term,Long buy probably green week policy surface.,12.27,https://picsum.photos/676/691,Salad
171,Degree,Town suggest note nor remain listen.,19.05,https://dummyimage.com/559x347,Dessert
172,Environment,Husband me part apply public both.,22.58,https://dummyimage.com/405x461,Burger
173,Management,Go just budget technology simply pretty.,16.44,https://placekitten.com/408/644,Pasta
174,Forward,Item have test worker type yourself.,22.56,https://dummyimage.com/674x621,Pizza
175,Point,Thousand argue tree ball coach security off.,32.37,https://dummyimage.com/493x320,Salad
176,Property,Ago defense suddenly discover as that.,8.35,https://dummyimage.com/475x817,Salad
177,Lawyer,Result represent despite team much line.,45.08,https://picsum.photos/294/693,Dessert
178,Truth,Why performance doctor cultural politics.,44.06,https://picsum.photos/361/1013,Pizza
179,Like,Win continue production treatment ago view result though.,28.49,https://picsum.photos/173/792,Salad
180,Book,Result local administration once might never sort together.,26.83,https://placekitten.com/753/100,Pizza
181,As,The pressure guy that enough choice.,10.8,https://picsum.photos/901/515,Pasta
182,Place,Information theory occur audience in.,24.4,https://picsum.photos/542/196,Sushi
183,Hospital,Together yard choose away.,25.02,https://picsum.photos/347/408,Sushi
184,Effect,Away police while computer provide debate.,27.6,https://placekitten.com/148/280,Pasta
185,Society,Society want no training low might.,31.88,https://picsum.photos/360/586,Pizza
186,Base,Left visit animal character suggest draw.,46.5,https://dummyimage.com/826x423,Burger
187,Free,Already alone ok notice oil yet price.,10.8,https://picsum.photos/505/108,Salad
188,Method,Remember start eye business spring threat common so.,37.87,https://dummyimage.com/915x321,Sushi
189,Million,Color exist book break affect arm stock.,33.77,https://placekitten.com/40/462,Salad
190,Population,Among analysis interesting democratic.,49,https://picsum.photos/413/688,Pasta
191,News,Include no likely season get manage.,23.18,https://dummyimage.com/729x447,Burger
192,Your,Shoulder somebody real.,31.38,https://picsum.photos/153/489,Pasta
193,Sit,Brother himself pick mission assume throughout.,15.18,https://dummyimage.com/898x74,Pizza
194,Left,Kid seem up either game assume compare.,44.2,https://dummyimage.com/83x534,Dessert
195,Young,List impact especially strong nothing thus job.,11.03,https://picsum.photos/317/758,Burger
196,Still,Know certain pick section ten I.,18.58,https://placekitten.com/650/874,Burger
197,Window,Particularly more hundred notice nearly.,49.69,https://placekitten.com/643/661,Salad
198,Community,Shake leave let eye.,10.21,https://placekitten.com/662/255,Dessert
199,Behind,Eat economic seat tell people.,38.78,https://picsum.photos/471/657,Burger
200,Foot,Condition sea knowledge determine safe garden.,15.21,https://placekitten.com/731/287,Pizza
201,Too,Off growth owner teacher.,37.35,https://picsum.photos/627/22,Burger
202,Though,Attention stop nation nature traditional month contain.,25.34,https://placekitten.com/281/805,Dessert
203,Full,Stay bill about natural rock inside market.,37.04,https://picsum.photos/123/428,Burger
204,Page,Arm another on.,37.5,https://picsum.photos/839/74,Burger
205,List,Forget course fire voice same rest drop which.,42.55,https://dummyimage.com/708x661,Pasta
206,Individual,Could commercial college your painting someone however spring.,11.91,https://placekitten.com/558/299,Pasta
207,Whose,Note year green central arm clearly common.,24.48,https://placekitten.com/264/1003,Pizza
208,Specific,Draw social deep determine bring walk.,21.15,https://picsum.photos/500/313,Salad
209,Claim,Son effort magazine.,30.63,https://dummyimage.com/960x229,Salad
210,Quite,Else throughout share night away just minute but.,6.06,https://placekitten.com/496/929,Pizza
211,Should,Ground must month discussion we after.,45.67,https://dummyimage.com/1024x634,Burger
212,Day,Much majority front center simple card.,17.83,https://picsum.photos/669/388,Burger
213,Claim,Another someone something control account.,14.08,https://dummyimage.com/913x368,Pizza
214,Forward,Source your garden federal wish.,34.24,https://placekitten.com/201/233,Burger
215,Maybe,Draw nothing society threat right.,12.85,https://picsum.photos/858/437,Sushi
216,Tonight,What position standard away.,27.71,https://dummyimage.com/273x194,Burger
217,Bank,Ever stand race major.,13.71,https://dummyimage.com/33x101,Salad
218,Against,Pattern affect top claim sound policy mention.,11.68,https://placekitten.com/737/445,Sushi
219,Author,Why government fill each outside just change.,28.32,https://picsum.photos/907/822,Salad
220,Father,Market son home east level see.,39.94,https://placekitten.com/141/103,Pasta
221,Seem,Lose key together after may always.,43.75,https://placekitten.com/551/894,Dessert
222,Professor,Represent east population prepare.,8.84,https://placekitten.com/220/806,Pasta
223,Two,I without offer them.,33,https://picsum.photos/763/944,Dessert
224,Natural,Small indicate record response gas also term.,18.51,https://picsum.photos/254/417,Salad
225,Bar,Source lawyer draw indicate human.,11.25,https://placekitten.com/43/284,Dessert
226,Feel,Have this talk several already beat.,17.92,https://placekitten.com/662/145,Salad
227,Become,Total amount anything positive.,20.69,https://placekitten.com/721/736,Pasta
228,Capital,Occur student attention pressure explain training start draw.,46.18,https://picsum.photos/625/597,Pasta
229,Still,Total western can impact standard prepare.,48.91,https://placekitten.com/650/590,Sushi
230,Rise,Recent dream wait nice seem behavior particularly crime.,22.36,https://picsum.photos/218/904,Burger
231,College,Attack great build board.,22.41,https://picsum.photos/1008/75,Sushi
232,Everything,Reveal effort wrong office most better daughter.,49.08,https://placekitten.com/511/129,Pizza
233,Opportunity,Building data improve.,28.78,https://dummyimage.com/615x116,Dessert
234,Seek,Situation anything campaign exist painting cost laugh.,30.61,https://placekitten.com/757/445,Sushi
235,Include,Note move today author.,10.28,https://dummyimage.com/492x148,Salad
236,Race,Attack pretty town then radio course author.,49.26,https://dummyimage.com/146x812,Pasta
237,Discover,Point per product from defense foot.,17.16,https://dummyimage.com/223x518,Pizza
238,Art,Generation night series us season.,41.3,https://picsum.photos/524/325,Sushi
239,It,Something season law medical.,48.62,https://placekitten.com/768/70,Salad
240,Here,Could who particular.,42.69,https://placekitten.com/535/184,Salad
241,Use,Exactly career voice follow.,29.27,https://placekitten.com/37/596,Dessert
242,At,Station show skill security part beat develop.,46.44,https://dummyimage.com/500x911,Pasta
243,Education,System should very age film.,44.62,https://picsum.photos/899/736,Salad
244,Pressure,Exist pretty may else rock theory.,15.99,https://placekitten.com/917/612,Burger
245,Teach,Thousand politics too meeting.,11.98,https://placekitten.com/262/42,Sushi
246,Condition,Sit family employee science.,38.82,https://picsum.photos/772/180,Sushi
247,Firm,Scene walk staff teacher radio.,27.17,https://placekitten.com/752/860,Sushi
248,Such,Board most score professional throughout.,17.15,https://picsum.photos/917/538,Dessert
249,Natural,Firm close war people study together data.,5.58,https://dummyimage.com/172x78,Pasta
250,Technology,Return claim heart state nice use.,8.63,https://placekitten.com/301/662,Sushi
251,Follow,Price half home former.,47.8,https://placekitten.com/222/212,Dessert
252,Fire,Leave thing development approach.,9.89,https://placekitten.com/660/97,Sushi
253,Top,Memory theory learn his.,40.6,https://placekitten.com/639/193,Burger
254,Hard,Draw door present real present wind.,9.05,https://placekitten.com/723/948,Pizza
255,Discussion,Score over really.,9.85,https://picsum.photos/182/97,Sushi
256,Ask,Draw sense wife summer.,39.37,https://dummyimage.com/36x1002,Salad
257,Almost,Hand student beat often friend happy recognize.,18.97,https://dummyimage.com/133x491,Salad
258,Tonight,See color ground without someone focus night.,6.04,https://picsum.photos/618/567,Dessert
259,Republican,Check role number.,40.5,https://placekitten.com/212/402,Pizza
260,Among,Such agree air sport special behind.,37.25,https://placekitten.com/250/36,Sushi
261,Ever,Guess pressure strategy play Democrat mention time.,30.87,https://dummyimage.com/1014x320,Dessert
262,Certainly,Paper sing whom from newspaper.,35.58,https://dummyimage.com/629x763,Sushi
263,Fine,Tough total possible myself institution recent.,37.84,https://placekitten.com/732/947,Salad
264,Point,Light effort spend condition event mention.,46.68,https://dummyimage.com/310x862,Pasta
265,Likely,Or eight child stop.,45.74,https://dummyimage.com/884x728,Burger
266,Whether,Player billion manager if foot type.,14.34,https://dummyimage.com/681x207,Pizza
267,Have,Require relate past traditional seat radio.,35.57,https://placekitten.com/892/559,Salad
268,Decide,A check miss agent.,34.5,https://placekitten.com/175/559,Pizza
269,Wish,Building address finally change magazine.,5.69,https://dummyimage.com/259x513,Sushi
270,Name,Policy simple exactly put.,48.67,https://picsum.photos/613/376,Sushi
271,Eat,Serious difference themselves mission.,9.81,https://dummyimage.com/296x833,Dessert
272,Voice,Thousand write focus book us high financial.,24.83,https://dummyimage.com/212x786,Burger
273,Data,Decide condition defense possible.,13.45,https://picsum.photos/897/136,Burger
274,Skin,Future different finally bar hard or actually beyond.,47.92,https://dummyimage.com/346x282,Dessert
275,Indicate,Western again factor produce child.,49.31,https://dummyimage.com/510x126,Sushi
276,West,Community music push discover none but apply.,20.33,https://dummyimage.com/788x538,Pizza
277,Ball,Buy product decision food word type.,18.27,https://placekitten.com/354/962,Dessert
278,Or,Scene image later too control four social she.,37.83,https://dummyimage.com/524x713,Pasta
279,Purpose,Member choose suddenly.,49.06,https://placekitten.com/582/481,Pizza
280,Program,Writer result first voice.,22.71,https://dummyimage.com/485x418,Salad
281,Rich,Election top staff.,10.91,https://picsum.photos/1013/365,Sushi
282,Fill,Cell hour senior tell suggest military to coach.,33.53,https://placekitten.com/942/479,Pasta
283,Team,Total lot of.,7.51,https://picsum.photos/866/233,Pizza
284,Myself,Successful act same drug.,24.67,https://dummyimage.com/190x319,Pizza
285,Born,Finish fish plant early themselves place agree.,35.43,https://picsum.photos/636/581,Pasta
