858,Culture,Adult experience south purpose street.,12.51,https://placekitten.com/252/469,Dessert
859,New,Treat TV develop instead.,6.16,https://placekitten.com/431/591,Pasta
860,However,Beautiful scientist general would right seek.,29.61,https://picsum.photos/105/706,Burger
861,Carry,Term threat eye seem apply play.,26.34,https://dummyimage.com/163x961,Pasta
862,Upon,Fight turn five answer kitchen music hotel.,30.1,https://placekitten.com/221/1012,Pizza
863,Too,White between though child draw.,10.34,https://picsum.photos/693/337,Dessert
864,Sit,In point himself three.,6.04,https://dummyimage.com/194x899,Pasta
865,Teach,Appear power notice development member drop community.,26.32,https://placekitten.com/996/996,Pizza
866,Small,Which believe eye radio.,42.99,https://dummyimage.com/289x21,Pizza
867,Agency,Game lead section wear call.,36.19,https://picsum.photos/505/850,Pizza
868,While,Pull space effect report teacher lay yes.,12.72,https://dummyimage.com/299x894,Dessert
869,Ok,Chair guy hit hot pay three model.,43.12,https://picsum.photos/812/84,Pasta
870,Quality,Town hold life ground ready born.,13.68,https://placekitten.com/723/987,Pizza
871,Visit,Likely up factor wish.,6.72,https://dummyimage.com/494x573,Salad
872,Summer,Audience yet possible sister good reveal hair remain.,23.66,https://placekitten.com/35/943,Sushi
873,Either,Reach meet issue seek much past certainly describe.,36.61,https://placekitten.com/360/717,Burger
874,Finally,Chance close last commercial shoulder point almost step.,12.19,https://placekitten.com/415/378,Pizza
875,Play,Ten likely page ball.,22.5,https://picsum.photos/592/502,Burger
876,Send,Audience film art huge receive generation.,48.67,https://picsum.photos/826/939,Burger
877,Table,Wife chair window focus partner its.,15.79,https://dummyimage.com/598x386,Burger
878,Ahead,Task will their and.,19.58,https://placekitten.com/856/603,Pizza
879,Child,Also boy somebody east.,21.14,https://placekitten.com/335/431,Sushi
880,For,Surface job number once rather.,13.38,https://placekitten.com/332/593,Pasta
881,Treat,Medical room back.,12.98,https://picsum.photos/699/28,Pizza
882,Reflect,Medical can long mention manage practice.,9.8,https://dummyimage.com/67x407,Pasta
883,Represent,Ability report education entire just.,9.34,https://dummyimage.com/667x669,Sushi
884,Artist,Green space even.,13,https://placekitten.com/69/598,Sushi
885,Discuss,Owner nearly must professor talk brother why field.,43.82,https://dummyimage.com/135x36,Pasta
886,Certainly,At partner plan TV stand wide.,48.12,https://dummyimage.com/122x81,Dessert
887,Way,Speech call bank might.,37.82,https://picsum.photos/819/891,Dessert
888,Prepare,Sometimes science set down second leader.,23.42,https://picsum.photos/183/442,Salad
889,Collection,While truth eat professor none at carry.,24.41,https://placekitten.com/329/915,Burger
890,Remember,Threat there perform will.,16.93,https://picsum.photos/697/453,Salad
891,Perhaps,Design final development leave add.,14.18,https://picsum.photos/429/355,Pasta
892,Put,Film threat join leg environmental hospital tell.,13.41,https://placekitten.com/644/269,Sushi
893,White,Piece current your those.,19.03,https://placekitten.com/248/471,Sushi
894,Population,Me week whose method window.,5.59,https://picsum.photos/879/621,Sushi
895,Nation,End list behavior purpose section total break range.,23.86,https://picsum.photos/688/751,Dessert
896,Manager,Ten life against task vote song important sea.,34.44,https://picsum.photos/785/306,Dessert
897,Four,Position his into allow own entire across expect.,41.59,https://dummyimage.com/425x678,Dessert
898,Himself,Main protect bill gas list yet sense.,41,https://picsum.photos/976/689,Salad
899,Entire,Cultural indeed education begin also relationship relationship.,27.2,https://dummyimage.com/713x736,Sushi
900,Seek,Along clear old purpose case glass.,30.22,https://placekitten.com/964/466,Burger
