571,Agreement,Fight evidence class arrive.,14.27,https://picsum.photos/164/762,Burger
572,Win,System wish bill become.,15.54,https://dummyimage.com/15x202,Sushi
573,History,Huge stop administration treat.,47.83,https://dummyimage.com/66x884,Dessert
574,Minute,Range president left low available main.,22.77,https://placekitten.com/139/63,Dessert
575,Candidate,Father individual long hit tree help second.,38.18,https://placekitten.com/839/310,Pizza
576,Ability,Record might great expert fly.,40.47,https://placekitten.com/477/821,Salad
577,Me,Camera impact executive usually top hand drop however.,46.22,https://dummyimage.com/444x43,Dessert
578,Everybody,Young and herself find.,35.31,https://picsum.photos/738/508,Pasta
579,Test,Suddenly there could build cover.,37.23,https://picsum.photos/430/650,Sushi
580,Mrs,Left inside because foreign this TV could.,19.36,https://dummyimage.com/130x414,Pasta
581,Institution,Ago then say prevent find.,16.34,https://picsum.photos/874/446,Dessert
582,Voice,Piece offer dog effect bit.,12.21,https://placekitten.com/125/648,Dessert
583,Hundred,Technology dark mean compare at city.,41.31,https://dummyimage.com/640x804,Pasta
584,Interest,Affect true miss station.,32.99,https://dummyimage.com/868x48,Pasta
585,Talk,West sea door give campaign brother.,20.71,https://placekitten.com/167/318,Pasta
586,Lead,Prevent activity work maintain detail join.,32.44,https://placekitten.com/164/142,Pizza
587,All,Case suffer begin.,34.06,https://dummyimage.com/128x998,Dessert
588,Stand,Church occur main three.,37.8,https://picsum.photos/898/341,Burger
589,Mother,Despite fight huge drug exactly on size.,39.74,https://dummyimage.com/934x973,Burger
590,Family,Environment spring political term for avoid.,45.93,https://dummyimage.com/342x588,Pasta
591,Morning,Another we true ground age manager piece.,29.72,https://placekitten.com/743/990,Pizza
592,Peace,Whatever course need other top property state.,29.55,https://dummyimage.com/887x141,Sushi
593,Soon,Until oil dark wrong whatever town growth.,27.98,https://dummyimage.com/946x492,Dessert
594,Last,Trial reach interest record.,34.67,https://placekitten.com/952/883,Pizza
595,Current,Authority debate place interview major station.,6.99,https://picsum.photos/962/652,Salad
596,People,Here reason of a want never run.,28.2,https://placekitten.com/721/990,Burger
597,Central,Wish billion attorney.,19.09,https://placekitten.com/0/502,Pizza
598,Ago,Story few knowledge land very thing.,5.17,https://dummyimage.com/394x901,Dessert
599,Field,Popular job direction actually do.,42.9,https://dummyimage.com/501x138,Sushi
600,Little,Result season like property forward.,29.92,https://picsum.photos/387/847,Dessert
601,Teach,Mr carry difference among past party share.,5.02,https://placekitten.com/387/568,Dessert
602,Team,According safe like those information final bed.,27.47,https://picsum.photos/119/554,Salad
603,Consider,Suddenly yes five half.,36.69,https://dummyimage.com/1021x471,Pizza
604,Deep,Pressure ahead me figure third there.,24.77,https://placekitten.com/416/827,Pizza
605,Protect,North soon shake.,42.72,https://placekitten.com/394/541,Burger
606,Beat,Conference truth little be sense provide fill.,30.45,https://dummyimage.com/122x111,Burger
607,Film,Tax hundred music under rich when want.,47.83,https://picsum.photos/198/214,Dessert
608,Quite,Wait machine top interest his compare sit.,7.01,https://dummyimage.com/619x62,Burger
609,High,Artist only apply.,39.55,https://dummyimage.com/221x577,Pasta
610,Listen,Last standard expert glass production woman security.,34.22,https://picsum.photos/689/465,Salad
611,American,Room over possible key seven little seem.,14.52,https://dummyimage.com/476x670,Dessert
612,Reality,Even read test role population situation.,20.23,https://dummyimage.com/893x546,Burger
613,Happy,International mission goal water agreement hospital herself.,44.82,https://picsum.photos/742/689,Sushi
614,Region,Good note tree fear.,22.21,https://placekitten.com/76/46,Pasta
615,Two,Hair cultural be improve guess style lead why.,26.53,https://picsum.photos/273/162,Sushi
616,Dream,Year cut inside coach by toward.,34.06,https://placekitten.com/624/271,Dessert
617,Hard,Modern camera break voice pull image or.,25.15,https://placekitten.com/751/813,Pasta
618,Suffer,Various hand sort.,12.92,https://dummyimage.com/349x721,Dessert
619,Wife,Catch like every game very answer.,49.33,https://picsum.photos/664/747,Pasta
620,Western,Available safe wait sometimes determine test.,9.3,https://picsum.photos/85/197,Salad
621,Pass,Wrong computer TV true give season.,43.2,https://placekitten.com/756/184,Dessert
622,She,Morning through nice item interesting visit.,47.25,https://picsum.photos/952/504,Sushi
623,Trouble,Run chance act quality Democrat single common story.,14.33,https://picsum.photos/229/697,Dessert
624,Song,Dream their city item agreement.,37.17,https://picsum.photos/27/988,Sushi
625,During,Spend scientist thank place evidence discover.,21.27,https://placekitten.com/180/161,Salad
626,Tax,Radio do set reason them.,36.09,https://picsum.photos/850/732,Salad
627,Sometimes,Catch watch amount approach experience how.,29.67,https://picsum.photos/515/316,Sushi
628,Foot,Alone catch plant environment perform.,33.9,https://placekitten.com/12/581,Pizza
629,Office,Remember life there again down may class.,45.65,https://placekitten.com/132/824,Salad
630,Resource,Low realize course value.,18.25,https://placekitten.com/294/756,Dessert
631,Interest,Great above effect.,47.42,https://placekitten.com/690/820,Sushi
632,Only,Hotel contain bill actually.,39.05,https://picsum.photos/423/394,Sushi
633,Describe,American Congress section sing.,12.33,https://placekitten.com/130/48,Salad
634,Check,Whose PM now different.,48.38,https://dummyimage.com/240x649,Pasta
635,Environmental,Himself one begin her student weight later.,7.79,https://dummyimage.com/956x1015,Pizza
636,Write,Age organization during foot company card player.,15.74,https://picsum.photos/550/892,Pasta
637,Community,Worker student pull.,5.62,https://picsum.photos/689/720,Pasta
638,Relate,Person standard on eye or.,37.28,https://dummyimage.com/326x103,Sushi
639,Way,Color green seem kitchen your.,43.22,https://dummyimage.com/327x272,Sushi
640,Game,Employee director meeting more nature.,5.68,https://picsum.photos/567/145,Pasta
641,Six,Strong according television walk area lead sure.,9.88,https://picsum.photos/314/726,Pizza
642,Travel,Everybody north local TV all mission.,22.28,https://dummyimage.com/8x56,Burger
643,Even,Because nation church pay.,45.17,https://dummyimage.com/285x723,Sushi
644,Exist,Region north health partner.,32.11,https://picsum.photos/164/769,Sushi
645,Hard,Number kind should enjoy week indeed scene.,39.62,https://dummyimage.com/719x955,Pasta
646,Senior,Visit must attorney open drug build time.,37.05,https://dummyimage.com/362x312,Salad
647,Green,Action and part.,19.41,https://placekitten.com/789/301,Salad
648,Week,Exactly raise impact member.,23.13,https://placekitten.com/298/268,Sushi
649,Strong,Almost food contain present.,31.94,https://placekitten.com/575/659,Dessert
650,Result,Article late next knowledge chair now want recent.,42.06,https://placekitten.com/47/102,Burger
651,Enjoy,Few brother bag party.,30.68,https://placekitten.com/824/757,Salad
652,Page,Institution movement simply experience them authority during.,28.69,https://dummyimage.com/348x841,Burger
653,Though,School forward occur strong building.,40.98,https://placekitten.com/564/79,Sushi
654,Out,Risk too trouble.,19.64,https://placekitten.com/175/307,Pizza
655,Visit,Difficult save shake table make new kind should.,46.69,https://dummyimage.com/305x15,Salad
656,But,Almost hour across establish.,13.11,https://placekitten.com/271/931,Dessert
657,Teacher,Them cultural wear including.,37.54,https://placekitten.com/666/25,Pizza
658,Member,Want price discuss available newspaper point from call.,20.66,https://dummyimage.com/848x480,Pizza
659,Central,Religious heavy wrong beyond focus.,10.27,https://picsum.photos/524/629,Sushi
660,Effect,Throughout reduce cover.,29.2,https://picsum.photos/139/425,Pasta
661,Word,Drug local into.,31.75,https://dummyimage.com/733x66,Salad
662,Effect,Street although mention these population sort.,18.84,https://picsum.photos/202/885,Pizza
663,Individual,Believe become another yes true education security.,40.3,https://picsum.photos/111/835,Sushi
664,Personal,Really when example yet.,47.76,https://picsum.photos/946/93,Salad
665,Always,Pull nice whole walk material participant.,41.65,https://picsum.photos/723/94,Sushi
666,Card,Near writer now really.,21.92,https://picsum.photos/254/881,Salad
667,Per,Benefit provide certainly section yet ask trouble.,23.08,https://placekitten.com/784/305,Pasta
668,Main,Weight yes out water.,40.71,https://dummyimage.com/827x437,Salad
669,Others,Consumer dog sport.,20.94,https://placekitten.com/678/392,Salad
670,Own,Yes meet card wide.,15.67,https://placekitten.com/622/797,Burger
671,Sell,Stand fill foreign clearly party worker them.,34.58,https://placekitten.com/503/661,Sushi
672,Whatever,Yet down community mouth.,23.38,https://placekitten.com/220/436,Salad
673,Next,Result name follow interest stop experience his.,11.15,https://picsum.photos/501/115,Pizza
674,Friend,Book save real drive total relate operation.,21.36,https://placekitten.com/257/247,Pasta
675,Stand,Hospital themselves despite successful.,26.5,https://picsum.photos/1017/523,Sushi
676,Voice,Effect success air action production matter could.,37.84,https://dummyimage.com/482x721,Burger
677,Way,Skin purpose plan somebody look national job your.,43.34,https://placekitten.com/780/481,Sushi
678,Nearly,Let network air treat.,11.88,https://picsum.photos/910/167,Burger
679,Wear,West lay game store side movie way.,17.65,https://placekitten.com/587/418,Pizza
680,Crime,Remember wear civil option.,16.88,https://picsum.photos/91/245,Burger
681,Too,Energy model everything ten.,5.46,https://picsum.photos/309/152,Pizza
682,Poor,Culture tend memory professor.,37.86,https://dummyimage.com/427x456,Pasta
683,Paper,Place ability wife account defense really.,39.35,https://placekitten.com/230/441,Dessert
684,Same,Experience which require statement technology.,45.67,https://placekitten.com/75/966,Salad
685,Culture,Citizen face board concern group establish prepare.,44.79,https://picsum.photos/538/321,Sushi
686,Any,Develop five property seem performance strategy section.,37.76,https://picsum.photos/292/517,Pasta
687,Stop,Put worker deal decade month its.,40.75,https://placekitten.com/289/368,Sushi
688,Both,Consumer raise run drop drive.,45.27,https://picsum.photos/753/508,Burger
689,Along,Available arrive artist lay position.,44.36,https://dummyimage.com/592x748,Pizza
690,Coach,Impact wife miss forget action even.,5.56,https://placekitten.com/730/481,Sushi
691,Particular,Break defense like force test authority size.,47.29,https://picsum.photos/122/428,Pasta
692,Buy,Business this both some help.,46.21,https://picsum.photos/655/390,Dessert
693,Owner,Big think myself decide station campaign.,26.42,https://picsum.photos/709/845,Dessert
694,Cultural,Not federal around soon.,23.43,https://picsum.photos/609/723,Pasta
695,Level,Four participant including bank vote will figure.,44.64,https://dummyimage.com/826x364,Burger
696,Whether,Become goal even shake.,6.81,https://placekitten.com/166/250,Sushi
697,Choice,Fire method research material.,21.1,https://placekitten.com/385/604,Pizza
698,Article,Low model wall effect author project.,43.19,https://dummyimage.com/1000x203,Sushi
699,Better,Must nor start population thing message bag.,12.32,https://placekitten.com/168/697,Pasta
700,East,Clear knowledge from.,5.91,https://picsum.photos/291/13,Sushi
701,Detail,Anything perform perhaps pick decision.,5.14,https://dummyimage.com/689x137,Dessert
702,Baby,These find simple time your.,19.15,https://dummyimage.com/964x646,Pizza
703,Challenge,Serve see make million though.,42.01,https://placekitten.com/880/888,Pasta
704,Mr,Like smile must practice worker market.,43.86,https://placekitten.com/397/700,Salad
705,Wear,Enter spring with.,40.65,https://dummyimage.com/579x903,Salad
706,Environmental,Own woman modern remain course.,17.61,https://dummyimage.com/233x451,Burger
707,Art,Dream quickly care a land chance property myself.,19.94,https://dummyimage.com/643x12,Sushi
708,Create,Act report foreign option return court.,12.82,https://dummyimage.com/544x1009,Sushi
709,Mind,Answer model his laugh pay around hit.,49.8,https://placekitten.com/462/115,Sushi
710,In,Election citizen generation score material make.,49.08,https://picsum.photos/29/851,Burger
711,Onto,Time total full question financial be total.,45.59,https://dummyimage.com/883x561,Pasta
712,Budget,Into claim certain degree century bit onto.,24.64,https://placekitten.com/109/789,Burger
713,Middle,No vote range.,24.51,https://picsum.photos/1021/880,Dessert
714,Federal,Truth special you politics.,19.3,https://dummyimage.com/445x618,Pasta
715,Tough,Performance nature plan operation size oil note to.,17.13,https://picsum.photos/887/194,Sushi
716,In,Easy range thing strategy.,22.68,https://placekitten.com/933/920,Salad
717,Available,Along world deal lose.,30,https://placekitten.com/178/98,Pizza
718,Tell,Range quite visit as adult.,47.06,https://dummyimage.com/294x651,Salad
719,College,Back director consider energy.,14.87,https://placekitten.com/300/441,Burger
720,Trip,Could maybe customer painting international.,26.26,https://picsum.photos/456/931,Burger
721,Fear,Discuss kid safe along trip language.,11.17,https://placekitten.com/991/157,Salad
722,Director,Able grow base from night.,39.47,https://picsum.photos/783/319,Sushi
723,North,Maintain job head seat visit trade especially.,37.26,https://picsum.photos/7/910,Pasta
724,Anything,Week finally ability beautiful benefit daughter.,28.59,https://placekitten.com/618/600,Dessert
725,Agreement,Seat put with cup phone.,7.68,https://placekitten.com/163/225,Salad
726,Rate,From continue about month major too couple ten.,31.83,https://picsum.photos/605/354,Pizza
727,Teacher,Century leg must main friend future.,23.02,https://placekitten.com/363/837,Sushi
728,Leader,Weight who develop too there still.,42.3,https://placekitten.com/267/130,Salad
729,Drive,Course yeah value story.,18.11,https://dummyimage.com/506x117,Burger
730,Generation,Reality risk quality listen movement particularly arrive strong.,49.93,https://picsum.photos/182/638,Sushi
731,Or,Hope letter accept see second woman me.,14.65,https://picsum.photos/913/894,Pasta
732,Investment,Above condition news eight together east father.,42.21,https://dummyimage.com/36x351,Pasta
733,Very,Think hotel to politics.,16.2,https://dummyimage.com/231x745,Burger
734,Right,People ahead show help.,15.25,https://picsum.photos/764/856,Salad
735,Adult,Professional wish very people enough special manager look.,49.75,https://dummyimage.com/988x582,Sushi
736,Public,Radio where upon movement majority face.,40.5,https://placekitten.com/12/21,Pasta
737,Amount,Test art company wear.,32.64,https://dummyimage.com/737x729,Dessert
738,Well,Artist way capital return although.,17.8,https://dummyimage.com/844x957,Salad
739,Particular,Evening line second ready some TV space.,48.96,https://picsum.photos/896/119,Sushi
740,Letter,Certainly decide sea finish.,42.99,https://placekitten.com/883/511,Sushi
741,Those,Senior ever prove area amount.,29.41,https://dummyimage.com/765x873,Burger
742,Movement,Manage discussion many several dog agency oil.,44.62,https://dummyimage.com/200x521,Dessert
743,Knowledge,Building cultural animal available media past during.,18.81,https://dummyimage.com/686x938,Burger
744,Scene,Put second themselves compare most.,18.29,https://dummyimage.com/140x653,Salad
745,Not,Really community eat quite raise own.,27.84,https://picsum.photos/156/162,Salad
746,Guess,Together citizen good ready score skin.,7.71,https://picsum.photos/272/259,Dessert
747,Thought,Carry save marriage against term both.,22.34,https://dummyimage.com/589x101,Salad
748,Personal,Task either little national create appear.,43.88,https://placekitten.com/321/615,Sushi
749,No,Still Democrat fish area yourself.,49.47,https://dummyimage.com/967x236,Pasta
750,Remain,Budget land property.,37.54,https://placekitten.com/79/586,Salad
751,Begin,Tend drop argue health win.,34.06,https://dummyimage.com/515x29,Pizza
752,Control,Two town music thought door.,7.3,https://picsum.photos/790/81,Pizza
753,Miss,Line control wind determine study western.,43.93,https://placekitten.com/454/1024,Dessert
754,Store,Cost difference indeed include her sure resource.,28.12,https://picsum.photos/514/576,Sushi
755,Contain,On stand contain weight.,15.01,https://picsum.photos/929/772,Dessert
756,His,Mouth star deal plan gun nation.,29.55,https://placekitten.com/615/295,Pizza
757,Worker,Around remember science soldier raise need director.,12.24,https://picsum.photos/511/965,Salad
758,Guess,Difficult other own discussion meet visit consider simple.,20.89,https://dummyimage.com/335x518,Pasta
759,Cover,National top lose care do fine.,19.71,https://placekitten.com/13/223,Burger
760,Piece,South find service.,19.3,https://picsum.photos/950/1007,Dessert
761,Note,Night research ready subject.,22.21,https://dummyimage.com/412x237,Pasta
762,Between,Cause decision dark writer worker southern professional off.,39.45,https://placekitten.com/747/91,Burger
763,Against,About black kind fast support bag reduce law.,10.86,https://dummyimage.com/627x393,Sushi
764,Chance,Become dark determine record shake.,20.48,https://placekitten.com/998/515,Salad
765,Able,Factor institution success need them speak require.,31.89,https://placekitten.com/187/1017,Burger
766,Star,Physical professor worry if onto just TV.,20.71,https://dummyimage.com/788x273,Salad
767,Wall,Central shake rest.,49.85,https://picsum.photos/692/902,Pizza
768,Difference,Between not from stuff.,48.9,https://picsum.photos/796/210,Dessert
769,Unit,Difficult brother attack power turn.,22.27,https://dummyimage.com/338x757,Dessert
770,Pressure,Herself girl game Democrat marriage early.,48.11,https://picsum.photos/120/776,Pizza
771,Set,Want trip whole assume consider.,18.87,https://placekitten.com/21/678,Pizza
772,South,Fund item force picture PM herself.,45.4,https://picsum.photos/51/648,Burger
773,No,Yes way soldier experience heavy decision coach similar.,8.69,https://placekitten.com/461/976,Burger
774,Bring,Affect tax rock others often hospital.,34.24,https://dummyimage.com/108x420,Salad
775,Reveal,Hundred receive tell information decision bank.,9.32,https://picsum.photos/874/31,Sushi
776,Song,Hotel meeting boy within.,16.1,https://placekitten.com/886/792,Pasta
777,Sure,Pm cold sound meet certain perhaps.,9.02,https://placekitten.com/151/26,Pasta
778,Energy,Blood this fall people test manager recognize.,5.5,https://dummyimage.com/25x270,Dessert
779,Nothing,Clearly often area military.,38.63,https://dummyimage.com/186x23,Pizza
780,Recently,Store charge per strategy question stand side.,24.48,https://dummyimage.com/862x210,Burger
781,It,Pay authority camera positive current.,28.08,https://picsum.photos/976/152,Pasta
782,Will,Challenge perhaps yes group news.,34.33,https://placekitten.com/101/696,Pasta
783,Outside,And daughter hair decision focus.,42.1,https://picsum.photos/854/674,Burger
784,Require,Phone position thank bit.,5.81,https://picsum.photos/328/142,Pasta
785,Interesting,Hospital street hope least start build.,47.33,https://dummyimage.com/293x648,Pasta
786,Serve,Technology night easy third.,10.97,https://dummyimage.com/813x1001,Salad
787,Relationship,Occur record century indeed tell.,47.95,https://dummyimage.com/124x963,Pizza
788,Development,Suggest science lead between believe by.,14.75,https://picsum.photos/909/731,Sushi
789,Design,Go pattern sound east million take.,21.19,https://picsum.photos/591/427,Pizza
790,Election,Challenge radio cover write.,14.66,https://dummyimage.com/349x399,Sushi
791,Per,Spring manage law conference stand ten material.,40.11,https://picsum.photos/631/409,Salad
792,Seven,Piece camera never I expert adult simple.,46.22,https://placekitten.com/982/161,Pizza
793,Wind,Future red model team.,36.61,https://dummyimage.com/999x300,Burger
794,Suggest,Strong imagine Mrs scene interview.,30.2,https://picsum.photos/860/435,Burger
795,Wonder,Picture for run down adult Democrat toward itself.,25.5,https://placekitten.com/731/176,Burger
796,Summer,Center blue Republican relationship according.,20.07,https://placekitten.com/812/474,Salad
797,Hundred,Able both talk language trouble.,48.97,https://dummyimage.com/1001x129,Pasta
798,Artist,Finally human door enough within nation art worker.,45.97,https://placekitten.com/676/703,Sushi
799,Measure,Allow yeah each.,18.59,https://dummyimage.com/696x240,Dessert
800,Stuff,Skin since short country.,44.98,https://dummyimage.com/590x1003,Sushi
801,Deal,Sing hand record operation material.,9.59,https://dummyimage.com/713x970,Salad
802,College,No actually blood candidate happy.,49.68,https://placekitten.com/326/128,Sushi
803,Add,Window director him give space fund college.,44.04,https://picsum.photos/28/1002,Pasta
804,Risk,Trouble tough officer most on address.,29.48,https://dummyimage.com/228x856,Burger
805,Nor,Cultural actually room color increase keep.,49.39,https://placekitten.com/664/744,Pizza
806,Walk,Spring increase ahead.,20.33,https://picsum.photos/105/71,Burger
807,Where,Wife article hundred police simple.,5.47,https://picsum.photos/371/172,Burger
808,Law,Test send them table.,19.57,https://dummyimage.com/293x819,Dessert
809,Draw,Thought weight foot we pass.,40.81,https://picsum.photos/173/841,Pizza
810,Second,Exist seat trouble.,26.79,https://picsum.photos/389/990,Pasta
811,Concern,Response relationship impact who international.,5.04,https://dummyimage.com/787x939,Sushi
812,Put,Staff especially another attorney.,36.25,https://picsum.photos/322/302,Burger
813,Sport,Process one music group decade usually strategy medical.,32.08,https://placekitten.com/93/342,Pasta
814,Sell,Eye seek accept whatever enough truth.,42.89,https://picsum.photos/493/880,Burger
815,Through,Seven sing large over measure reduce majority.,46.71,https://placekitten.com/450/764,Salad
816,Mr,Back put glass design clear.,13.34,https://dummyimage.com/901x238,Dessert
817,Skin,Surface guy day newspaper drop.,14.79,https://placekitten.com/632/405,Salad
818,Everything,Professor protect son.,6.25,https://picsum.photos/1015/851,Sushi
819,Some,Rest collection prove against if often rise speak.,43.27,https://picsum.photos/1023/806,Burger
820,Understand,Try trip agreement.,27.61,https://picsum.photos/493/162,Pasta
821,Between,Else management without provide development them artist.,32.19,https://placekitten.com/437/892,Pasta
822,Same,Research but security hit anything structure real.,8.06,https://placekitten.com/334/247,Sushi
823,Specific,City occur thing character ball season partner.,18.28,https://placekitten.com/950/153,Burger
824,Anyone,May mother student spend similar theory.,17.64,https://picsum.photos/22/765,Pizza
825,Edge,Work ten really sign grow.,20.52,https://picsum.photos/189/861,Dessert
826,Someone,Much education pull tonight common.,29.76,https://placekitten.com/97/253,Dessert
827,Drug,Treatment teacher mouth act away position its herself.,6.12,https://placekitten.com/85/756,Dessert
828,Oil,Of beyond cover fact move responsibility material.,49.86,https://placekitten.com/341/719,Pizza
829,Response,Admit start town miss control.,9.66,https://placekitten.com/108/731,Pizza
830,Mouth,Any ever partner trip company.,14.35,https://placekitten.com/214/143,Pasta
831,Song,Soldier likely conference hit relationship film any.,31.28,https://placekitten.com/158/472,Salad
832,Improve,Yard sea but myself already.,28.49,https://placekitten.com/254/942,Pizza
833,Good,Various direction southern yard morning ask call.,19.2,https://dummyimage.com/233x637,Pizza
834,Fish,Small form truth war lead their laugh.,21.11,https://placekitten.com/550/940,Pasta
835,Know,Ability next to tough fear.,48.4,https://picsum.photos/679/843,Dessert
836,North,That plant chance town office church including.,10.04,https://dummyimage.com/652x244,Sushi
837,Will,Eye produce attorney summer whose.,8.85,https://placekitten.com/268/753,Salad
838,Set,Guess thought sense organization history marriage world.,40.11,https://picsum.photos/644/422,Dessert
839,Result,Ready both put.,35.83,https://picsum.photos/837/956,Pizza
840,Resource,People create each school score.,28.9,https://picsum.photos/852/427,Dessert
841,Assume,Feel think collection fund thank during.,22.63,https://picsum.photos/945/301,Dessert
842,Finally,Stage serious better if.,47.09,https://picsum.photos/442/27,Pizza
843,Newspaper,Also soldier or either.,39.57,https://dummyimage.com/532x453,Salad
844,Small,Increase ready cause leave.,32,https://dummyimage.com/844x469,Sushi
845,Property,Soon site investment.,30.18,https://placekitten.com/130/1024,Dessert
846,Operation,Space hair above role now company.,39.04,https://placekitten.com/330/220,Pasta
847,Source,Company bill talk you.,5.26,https://placekitten.com/459/309,Dessert
848,Opportunity,Strategy fine gun style range finish American.,30.67,https://placekitten.com/991/725,Burger
849,Wonder,Ask address response score radio.,48.58,https://placekitten.com/713/597,Burger
850,Drop,Growth down standard accept idea medical.,9.82,https://picsum.photos/719/452,Sushi
851,Half,Despite attention line mouth walk.,34.33,https://picsum.photos/885/952,Burger
852,May,Office for lay power better marriage per.,20.65,https://placekitten.com/530/682,Salad
853,Three,Tonight night huge democratic.,45.03,https://placekitten.com/864/751,Dessert
854,Third,Network go well responsibility.,29.3,https://placekitten.com/963/801,Sushi
855,Once,We action friend former great although bed number.,25.47,https://picsum.photos/173/604,Burger
856,As,Billion many will.,6.82,https://picsum.photos/585/20,Pizza
857,Effect,Weight family wait share teach.,38.28,https://picsum.photos/116/1005,Salad
